name,slug,description,category,duration,price,metaTitle,metaDescription,destinations,highlights,itinerary,pricingTiers,timingAvailability,inclusions,exclusions,amenities,transport
Himalayan Adventure Trek,himalayan-adventure-trek-exp,Experience the breathtaking beauty of the Himalayan mountains with expert guides and comfortable accommodations.,Adventure,7,45000,Himalayan Adventure Trek - Best Mountain Trekking Tour,Explore the stunning Himalayan peaks with our guided trekking tour. Book now for an unforgettable mountain adventure.,Bangalore,Stunning mountain views|Expert guides|Comfortable lodges|Local cuisine,Day 1: Arrive in Manali|Day 2: Trek to Solang Valley|Day 3: Rohtang Pass exploration|Day 4-7: Return journey,Standard|Premium|Luxury,8:00,Accommodation|Meals|Guide|Transportation,Alcohol|Personal expenses,Medical Assistance|Wheel Chair|Escorted Guide,Sedan|SUV
Kerala Backwaters Cruise,kerala-backwaters-cruise-exp,Relax on traditional houseboats and explore the serene backwaters of Kerala with scenic beauty.,Leisure,5,35000,Kerala Backwaters Cruise - Houseboat Tour,Enjoy a peaceful houseboat cruise through Kerala's backwaters. Experience authentic Kerala hospitality.,Bangalore,Houseboat experience|Sunset views|Local food|Ayurvedic spa,Day 1: Arrive Kochi|Day 2-3: Houseboat cruise|Day 4: Backwater exploration|Day 5: Departure,Standard|Premium|Luxury,9:00,Houseboat|Meals|Guide,Alcohol|Personal expenses,Medical Assistance|Pandit Coordination|Escorted Guide,Sedan|Houseboat
Rajasthan Royal Tour,rajasthan-royal-tour-exp,Discover the magnificent palaces and forts of Rajasthan with luxury accommodations and guided tours.,Cultural,8,55000,Rajasthan Royal Tour - Palace & Fort Experience,Explore the royal heritage of Rajasthan. Visit iconic palaces, forts, and experience authentic Rajasthani culture.,Bangalore,Palace visits|Fort exploration|Camel safari|Local markets,Day 1-2: Jaipur city tour|Day 3-4: Udaipur palaces|Day 5-6: Jodhpur forts|Day 7-8: Pushkar fair,Standard|Premium|Luxury,10:00,Accommodation|Meals|Guide|Camel safari,Alcohol|Personal expenses,Mahaprasad Arrangement|Medical Assistance|Escorted Guide,Sedan|SUV
Goa Beach Getaway,goa-beach-getaway-exp,Relax on pristine beaches enjoy water sports and experience the vibrant nightlife of Goa.,Beach,4,28000,Goa Beach Getaway - Tropical Paradise Tour,Spend your vacation on beautiful Goa beaches. Water sports resorts and nightlife included.,Bangalore,Beach relaxation|Water sports|Nightlife|Local seafood,Day 1: Arrive Goa|Day 2-3: Beach activities|Day 4: Water sports and departure,Standard|Premium|Luxury,11:00,Accommodation|Meals|Beach activities,Alcohol|Personal expenses,Medical Assistance|Assistance for Senior Citizens|Escorted Guide,Sedan|Taxi
Spiritual Varanasi Journey,spiritual-varanasi-journey-exp,Experience the spiritual essence of Varanasi with temple visits Ganga Aarti and meditation sessions.,Spiritual,3,18000,Spiritual Varanasi Journey - Holy City Tour,Discover the spiritual heart of India. Attend Ganga Aarti and visit sacred temples in Varanasi.,Bangalore,Ganga Aarti ceremony|Temple visits|Meditation|Boat rides,Day 1: Arrive and evening Aarti|Day 2: Temple exploration and meditation|Day 3: Sarnath visit and departure,Standard|Premium|Luxury,12:00,Accommodation|Meals|Guide,Alcohol|Personal expenses,Pandit Coordination|Mahaprasad Arrangement|Medical Assistance,Sedan
